movie_id,title,release_date,total_box_office,avg_ticket_price,screening_count,attendance_rate,country,overall_rating,description
772,边海,,889000.0,,19939.0,19.313636363636363,,,中国京族小伙阿勇和好兄弟阿成在边贸互市邂逅越南姑娘阿花，三个人依托中越边贸互市合作生意，在长期交往中互生爱慕，情感纠葛不休。奈何惹人眼馋，遭陷害血本无归。6年后，阿勇逐渐发展成越南海鲜产品的国内供货商；阿成出狱后也和当年所救女孩阿梅终成眷属，造就了这份中越跨境爱情的美好；阿勇四处寻找阿花，在不断的追逐着阿花的脚步，正所谓“跨越山海只为遇见你……
773,温暖的抱抱,2020-12-31,669530000.0,37.0,,,中国,5.2,"鲍抱（常远 饰）是一名普通的钢琴教师，许是童年的影响，导致现在的他有着十分偏执的洁癖，他的生活仿佛被卡尺精确测量规定过一样，一丝不苟，毫厘不差，却令他倍感窒息，以至于试图结束自己的生命。而就在这个紧要关头，开朗乐观的宋温暖（李沁 饰）闯入了鲍抱的人生。温暖灵动可爱，是一个颇有才华的音乐创作人。但是此前曾被恶德男友（乔杉 饰）利用压榨，几乎沦为了创作机器。就这样，两个性格和背景完全迥异的年轻人，意外走到了一起，他们多姿多彩而又令人捧腹的故事由此展开……
影片根据韩国电影《计划男》改编。"
774,云边有个小卖部,2024-06-22,498000000.00000006,41.0,490073.0,4.039999999999999,中国,5.0,普通青年刘十三（彭昱畅 饰），在城市中迷失自我，被外婆（艾丽娅 饰）带回了故乡，一个云边的小镇。童年好友程霜（周也 饰）和外婆陪伴着他，刘十三度过了一段平静的时光。他沿着祖祖辈辈留下的痕迹，认真倾听小镇的呼吸，在伸手能摸到云的小卖部，在高山与大海之间，在院子的桂花树下，逐渐走出往日的迷惘。有些人刻骨铭心，没几年就遗忘。有些人不论生死，都陪在你身旁。
775,天衣无缝,,4720.0,,23.0,84.0,,6.2,《天衣无缝》改编自张勇的小说《贵婉日记》，本作也是继《一触即发》、《伪装者》后“谍战三部曲”的收官之作。故事背景和《伪装者》相同，时间线稍微提前。
776,黑豹,2018-03-09,662590000.0,36.0,,,美国,6.5,"位于非洲的神秘国家瓦坎达，凭借来自宇宙的振金而成为科技极度发达的国家，不过他们长久封闭，始终对外界保守这个秘密。在前国王死于联合国爆炸袭击后，特查拉王子（查德维克·博斯曼 Chadwick Boseman 饰）继任成为新的国王，同时他也是黑豹的继承者。登基之后，特查拉与前女友娜吉雅（露皮塔·尼永奥 Lupita Nyong'o 饰）、贴身侍卫奥姆烨（丹娜·奎里拉 Danai Gurira 饰）追查曾经盗取振金并杀害瓦坎达人的尤利西斯·克劳（安迪·瑟金斯 Andy Serkis 饰）。一番厮杀后，克劳侥幸逃脱，谁知最终死于合伙人艾瑞克·克尔芒戈（迈克尔·B·乔丹 Michael B. Jordan 饰）之手。艾瑞克同样具有瓦坎达血统，而且当年他的父亲死在了自己的兄弟——特查拉父亲的手中。
怀着莫大的仇恨，艾瑞克踏足瓦坎达，去争夺至高无上的王位……"
777,文姬归汉（戏曲 京剧）,,2196.0,,31.0,,,,1917年，邓恩铭面对贫困的生活环境和腐朽的封建思想，借求学之机告别父母，从贵州荔波投奔至济南堂叔黄泽沛处。受马克思主义的影响，邓恩铭坚定不移地走上共产主义道路，开启了在山东短暂而辉煌的革命历程。
778,一和多,,89000.0,,197.0,23.903846153846153,,,影片讲述一次选拔，也是一次旅程和一次发现。一辆汽车在青海玉树高原上缓缓前行，车内乘坐着寻找藏族儿童好声音的导师们。他们深入雪山遍访学校，在那些质朴纯真的孩子们中寻找最具天赋潜质的声音……高原四季轮转，生命勃然延续，回荡在万物生长中的歌声永恒。
779,机器人之梦,,11934000.0,,6641.0,23.76727272727273,,9.1,"一只孤独的小狗遇到了一个机器人，偌大的城市中，他们互相依靠，温暖彼此。然而一次意外让小狗和机器人遗憾错过，从此他们只能把对彼此的想念藏进梦中。只是，反复梦见的人，还会重逢吗？
影片改编自Sara Varon的漫画。"
780,一路幸福,,5804000.0,,1.0,,,,如果说交通是一个城市流动的血脉，那公共交通则是跳动的脉博。首都北京，拥有世界上最庞大的城市地面公交系统。每天约有千万人通过公共交通出行。穿行于大街小巷的公交车，星罗棋布的公交站点，律动着整个城市空间，也见证了千年古都从封闭、老旧走向开放、现代的历程。这是一部北京公交的百年史，也是一份北京城市的百年回忆，更是几代北京人的时光相簿，记录下人们在一个个奔向幸福的黎明和晚霞中，流转的百年时光。
781,烟火人间,,1040000.0,,59.0,39.74285714285715,,6.8,"首部由509位普通人拍摄的纪实影像共创而成的竖屏院线电影。
影片通过鲜活、生动、直接、朴素的自拍影像，呈现了一个背井离乡、奋力拼搏在社会生产一线的当代中国人群像：他们在田野上、在工厂里、在运输途中、在钢筋水泥间，体验着生命的酷暑与寒冬。
一个个跌跌撞撞却又欢颜前行的人物，在面对困境与征服困境的循环往复中展现出强大的人格力量，在漂泊奋斗与身心还乡中勾勒出属于国人的情义世界。影片从物质追求和精神归宿两方面关注快速变迁的时代背景下那些微小却饱含生命力的个体，通过芸芸众生的“自画像”看见一个生动真实的当代中国。"
782,三大队,,705000000.0,,82.0,7.300000000000001,,7.6,"刑侦大队队长程兵（张译 饰）带领的三大队在办理一起恶性案件的过程中导致嫌犯之一意外死亡，被判入狱。出狱后依然坚持以普通人身份追踪在逃嫌犯。
影片根据真实事件改编，原载于“网易人间工作室”作者深蓝的《请转告局长，三大队任务完成了》。"
783,奔跑吧，麋鹿,,344000.0,,18903.0,22.734482758620683,,,黑暗中高速驶来的车辆，伴随着撞击与尖叫，撞碎了女孩的童年，从此她的世界变得封闭、不安、破碎。曾经温馨的回忆也会随时随地引起女孩的恐慌发作。守护在女孩身边的妈妈也逐渐变得脆弱和敏感，她不得不随时处理女孩因为应激反应而造成的一系列麻烦……这是一个关于“成长与救赎”的温情故事。由于一次意外的车祸，女孩患上了严重的“创伤应激障碍”，开始自我封闭，拒绝与外界交往。一次与麋鹿的偶遇，彻底改变了这一切……
784,红色裁判,,42000.0,,12.0,,,,1928年初，工农革命军在遂川建立了工农兵政府，并设立了裁判部。该部以《工农兵政府临时政纲》为依据，审理了诸多民事案件，并重新调查审理了旧衙门留下的刑事积案。为我党领导的早期司法实践，烙上了红色印记！
785,奇迹·笨小孩,2022-02-01,1379930000.0,46.0,,,中国,7.4,"二十岁的景浩（易烊千玺 饰）独自带着年幼的妹妹来到深圳生活，兄妹俩生活温馨却拮据。为了妹妹高昂的手术费，机缘巧合之下，景浩得到一个机会，本以为美好生活即将来临，却不料遭遇重创。在时间和金钱的双重压力下，毫无退路的景浩决定孤注一掷，而他陷入困境的平凡人生，又能否燃起希望的火花？
电影《奇迹》是中宣部国家电影局2021年重点电影项目，也是2021年重点建党百年献礼片，描述十八大以后新时代年轻人在深圳创业的影片。"
786,茶啊二中,,384000000.0,,81.0,,,7.3,初三三班最调皮的“学渣”王强（邢原源 配音）和“暴躁班主任”石妙娜（王博文 配音）意外互换了身体，压迫已久的王强过了一把当班主任的瘾，石妙娜也体会到了做“学渣”的滋味。石妙娜的公开课比赛日期临近，二人急需找到换回身体的方法，却遇到重重阻碍……
787,开国大典(下集),,107000.0,,5.0,,,8.1,举世闻名的辽沈、淮海、平津三大战役胜利后，西柏坡军民欢庆胜利。三大战役的胜利使蒋家王朝摇摇欲坠，蒋介石（孙飞虎 饰）发表“新年文告”、推出李宗仁（邵宏来 饰）任代总统，导演了一幕假隐退真操纵的丑剧。1949年1月21日，蒋介石由汤恩伯（叶庆林 饰）、蒋经国（陈国典 饰）等陪同，最后一次登上中山陵，之后又在其老家奉化溪口主持了高级军事会议，妄图阻止解放军过长江。3月，中共七届二中全会召开，4月，毛泽东（古月 饰）与朱德（刘怀正 饰）。总司令发出了向全国进军的命令。人民解放军百万雄师强渡长江，攻占总统府，南京胜利解放。5月24日，蒋介石逃往台湾。5月26日，上海解放。随后，全国大部分地区和城市都获得解放。毛泽东先后在中南海会见了国民党起义将领和各界民主人士。开国大典迫在眉睫......
788,你好，之华,,80202000.0,,257.0,,,6.6,"生死离别，红颜薄命。告别了命途乖离的姐姐，袁之华（周迅 饰）带着些许落寞的心情和丈夫以及姐姐的儿子晨晨踏上归途。临走的时候，她从外甥女睦睦（邓恩熙 饰）手中接过一封邀请函，这是姐姐袁之南初中同学会的邀请。在久别重逢的老友欢聚环境中，被众人当作之南的之华无法坦然道出姐姐去世的事实。她选择先行离去，途中却又与姐妹俩的旧相识尹川（秦昊 饰）重逢。在此之后，之华以姐姐的名义给尹川写信，重温青葱时代的记忆。与此同时，待在老家的睦睦和之华的女儿飒然（张子枫 饰）接到了尹川的来信，出于对母亲过往的好奇，她们以稚嫩的笔触写了回信。
喧嚣匆忙的电子时代，两代人分出三地，重绘他们逝去的岁月人生……"
789,小美人鱼之大海怪传说,,7110000.0,,277.0,0.922222222222222,,,当神秘小美人鱼遇上了传说中的大海怪，深藏在海洋深处的秘密也由此揭开，一场充满惊险刺激的海洋冒险之旅即将开启……
790,南京！南京！,2009-04-22,159760000.0,30.0,,,中国/中国香港,7.6,"1937年12月13日，时为国民政府首都的南京城沦陷，部分官员弃城逃亡，但仍有许多官兵留守，誓死保卫这个大厦将倾的城池。
宋锡濂部军官陆剑雄（刘烨 饰）协同战友与日军展开了激烈的巷战，他们微弱而顽强的抵抗最终被压制，数以万计的中国军民成为俘虏，在枪炮声中血染长江；金陵女子学院安全区，女教师姜淑云（高圆圆 饰）奔波往复，尽力帮助和拯救所有来此避难的同胞，但兽性大发的日军早已虎视眈眈盯上了藏身于此的妇女；拉贝的秘书唐先生（范伟 饰）小心应付，委曲求全，为了保护家人而做出错误的选择，他也为此付出代价；舞女小江（江一燕 饰）纵使逃亡避难也不愿抛却女性的柔媚，她在关键时刻的选择则在其女性的外壳下注入一份刚强；日本人角川（中泉英雄 饰）随部队进驻这个千疮百孔、破败不堪的城池，在这个人间炼狱，他的心灵感受到前所未有的巨大冲击。
狼烟滚滚，血流成河，大时代的背景下，..."
791,夏日旋律,,2175.0,,609.0,0.31666666666666665,,,和家人发生争吵而离家出走的马厚，在一个陌生的城市偶遇了马逗逗。两人在相处交往中，马厚逐渐从一个不思进取、游手好闲的人变成了对生活充满热情，对未来充满希望的阳光青年。
792,巨齿鲨2：深渊,2023-08-04,851990000.0,42.0,,,美国/中国,5.0,乔纳斯·泰勒（杰森·斯坦森 饰）与科学家张九溟（吴京 饰）双雄联手，进入海底7000米深渊执行探索任务。他们意外遭遇史前巨兽海洋霸主巨齿鲨群的攻击，还将对战凶猛危险的远古怪兽群。惊心动魄的深渊冒险，巨燃巨爽的深海大战一触即发……
793,我是霸王龙,,35423000.0,,18.0,,,4.2,恐龙之王巅峰对决！作为地球有史以来最大的陆地生物，恐龙一直对人类有着强烈的吸引力。穿越6500万年前白垩纪晚期，走进一个神秘五彩斑斓的恐龙新世界，生动再现奇特而壮观的史前时代，一段关于陆地最强王者霸王龙惊险刺激的冒险即将呈现……
794,信仰无敌,,850000.0,,1041.0,25.09242424242424,,,"电影《信仰无敌》讲述了大革命后期，国民党反动派背叛革命，利诱杀戮，妄图用震慑和腐化摧毁中国共产党。生死存亡之际，共产党人杨匏安临危受命，在党的第五次全国代表大会上当选首届中央监察委员会副主席，严格维护并执行党的纪律，坚决惩处叛徒，竭尽全力维护党的团结统一和队伍纯洁，被捕后坚守信仰、宁死不屈、慷慨就义的故事。
电影《信仰无敌》以杨匏安为主人公，以党的早期纪律建设为主线，集中勾勒出“首届中央监察委员会委员坚持革命且无一人变节”的壮烈图景，有力地展现了我们党始终重视加强纪律建设铸造纪律铁军从而赢得革命成功的的胜利密码。本片用情用力讲好中国故事，满足人民文化需求和增强人民精神力量，从历史考证、剧本撰写、到场景设置、拍摄制作均精益求精，力求以真实的场景、感人的细节、生动的人物塑造，展现革命先烈为民族大业、人民解放而用生命和鲜血写就的伟大历史功勋。"
795,金剑行动,,12000.0,,1.0,,,,影片讲述了警方在破获一件文物走私案之后，文物缉查队队长宋阳与犯罪团伙斗智斗勇，最终解决了十年前悬案的故事。
796,加拉帕戈斯：自然的仙境,,1044000.0,,148.0,43.58278688524589,,7.6,"In the vastness of the Pacific Ocean, there is a paradise unlike any other: the Galapagos archipelago. Amongst these fascinating and remote volcanic islands, life has played out over millions of years in relative isolation. The result is a wonderland of nature, with a remarkable collection of plants and charismatic animals that have all adapted to this unique environment. Meet ..."
797,神偷奶爸2,,323000000.0,,3.0,1.4,,8.1,"自从与玛戈（米兰达·卡斯格拉夫 Miranda Cosgrove 配音）、伊迪丝（达娜·盖伊 Dana Gaier 配音）和阿格蕾丝（埃尔希·费舍 Elsie Fisher 配音）三个可爱的小女孩实现宿命的邂逅，曾经的大坏蛋格鲁（史蒂夫·卡瑞尔 Steve Carell 配音）可真彻底转型了，他金盆洗手，转而化身为慈祥可亲的爸爸和做得一手烂口味布丁果冻的商人。当然凡事没有尽善尽美的，在此期间，憧憬大坏蛋传奇人生的老搭档纳法利欧博士（拉塞尔·布兰德 Russell Brand 配音）离他而去，另谋高就。某天，格鲁被身怀绝技却鲁莽的特工露西·王尔德（克里斯汀·韦格 Kristen Wiig 配音）绑架，原来露西所在的集团研制出可以改变生物基因的药物，可他们位于北极圈的实验室被神秘窃贼偷走，因此才委托有过坏蛋经验的格鲁做卧底。
经过一番考虑，格鲁接受了这项..."
798,向阳花,,,,10.0,,,6.3,"锒铛入狱，天崩开局，刑满释放女囚如何困境求生？
为给女儿购买价值20万的人工耳蜗，高月香（赵丽颖 饰）铤而走险，被判刑入狱，却因这段经历结识了黑妹（兰西雅 饰）、邓虹（啜妮 饰）、胡萍（王菊 饰）、郭爱美（程潇 饰）。她们虽然性格不同，但却都有“和生活硬碰硬”的态度，不服输、不认命的她们，面对命运挑战一路为彼此撑腰，向阳而生。"
799,蝙蝠侠：黑暗骑士崛起,2012-08-27,338780000.0,37.0,,,美国/英国,8.9,检察官哈维·登特（艾伦·艾克哈特 Aaron Eckhart 饰）死后的八年间，哥谭市在戈登警长（加里·奥德曼 Gary Oldman 饰）的努力下有效地遏制了犯罪活动。而蝙蝠侠布鲁斯·韦恩（克里斯蒂安·贝尔 Christian Bale 饰）因为背负谋杀登特的罪名，被 警方通缉，在哥谭市销声匿迹。然而，这看似平静的状态被恐怖分子贝恩（汤姆·哈迪 Tom Hardy 饰）的出现打破，他利用猫女（安妮·海瑟薇 Anne Hathaway 饰）偷取布鲁斯的指纹，致使韦恩集团面临破财，布鲁斯被赶出董事会。为了保证韦恩集团投资的能源项目不被坏人利用制造核弹，布鲁斯帮助米兰达（玛丽昂·歌迪亚 Marion Cotillard 饰）成为董事会主席。贝恩接下来一连串精密设计的计划将哥谭市陷入孤绝之境，毁灭之日指日可待。布鲁斯只能再次肩负起拯救哥谭的重任，然而至亲的...
800,朱同在三年级丢失了超能力,,15158000.0,,404.0,3.7771428571428576,,7.7,三年级小学生朱同，他成绩垫底、调皮捣蛋，每天他的小脑瓜里都会出现一万种幻想。然而有一天，他发现班主任牛老师居然在走廊上追打外星人、草坪中的小花会说话、同学变成了杂草人......无数令人匪夷所思的事件纷至沓来，离奇幻想与学校生活的苦恼交织。朱同能否顺利逃过惩罚，又能否如愿以偿代表学校参加全国广播操比赛？一场现实与奇幻交织的旅程即将展开……
801,铁甲钢拳,,122000000.0,,1.0,,,8.3,"2020年，未来一个并不遥远的年份，整个世界已经发生了许多变化。在那个时代，人类拳击不再被允许，取而代之的是各种机器人走上了擂台，继续这项火爆的运动，愉悦大众。前拳击手查理·肯顿（休·杰克曼 Hugh Jackman 饰）似乎并不那么落寞，他很快适应了时代的发展，带着经过训练的机器人一次次走上拳台。但是倒霉事接二连三，他先是意外落败，债台高筑，继而接到前女友突然过世的消息，并见到了从未谋过面的儿子——11岁男孩麦克斯（达科塔·高尤 Dakota Goyo 饰）。
一次意外，让麦克斯遇到了一台业已被淘汰的陪练机器人Atom。在麦克斯的坚持下，查理同意让Atom参加比赛，却意外发现这台“废物”不仅抗打，而且拥有搏斗的潜质与天赋。肯顿父子和他们的机器人由此踏上新的征途……"
802,太空熊猫英雄诞生,,5242000.0,,75.0,0.5,,,动画电影《太空熊猫英雄诞生》是《太空熊猫》系列动画电影的初章，讲述了未来地球上的一名熊猫人如何强化自己的力量与意志，最终成为一名守护地球的超级英雄的故事。
803,疯狂丑小鸭,,23441000.0,,74.0,,,2.4,"故事发生在一个美丽的鸟类王国之中，某日，反对派的叛变破坏了这里的宁静。主人公丑小鸭（苏倩芸 配音）的父母为了保护琉璃鸟而神秘失踪。为了解开琉璃鸟的秘密，找到自己的父母，丑小鸭和好朋友丑小八（王雪沁 配音）踏上了寻找老猫法师的征程。然而，他们并不知道危险正在悄然逼近。
在反对派的鼓动下，鸟类对人类发动了战争。为了阻止战争的进一步扩大，丑小鸭决定登上琉璃塔，这是一座神秘的塔，背后可能隐藏着天大的秘密。这个决断表明了丑小鸭为了保护王国和解开谜团愿意付出一切。前方等待着丑小鸭的将会是什么，可能是艰难的冒险、重重困难，以及关乎整个王国未来的秘密。"
804,月光武士,,2033000.0,,2.0,70.9,,4.7,影片根据虹影同名长篇小说改编，以重庆“山城”为地理背景，讲述了在1976年，12岁少年窦小明因受伤进了医院，认识了对他照顾和关爱有加的护士佳惠。佳惠生得美貌，却嫁给当地混社会的青年钢哥，常常遭受家暴。窦小明得知此事后站出来打抱不平，从此改变了他们三人的命运。
805,中国合伙人,2013-05-17,540000000.0,32.0,110.0,2.066666666666667,中国/中国香港,7.6,"20世纪80年代，三个怀有热情和梦想的年轻人在高等学府燕京大学的校园内相遇，从此展开了他们长达三十年的友谊和梦想征途。出生于留学世家的孟晓骏（邓超 饰）渴望站在美国的土地上改变世界，浪漫自由的王阳（佟大为 饰）尽情享受改革开放初期那蓬勃激昂的青春气息，曾两次高考落榜的农村青年成冬青（黄晓明 饰）以晓骏为目标努力求学，并收获了美好的爱情。然而三个好友最终只有晓骏获得美国签证，现实和梦想的巨大差距让冬青和王阳倍受打击。偶然机缘，被开除公职的冬青在王阳的帮助下办起了英语培训学校，开始品尝到成功的喜悦。在美国发展不顺的晓骏回国，并加入学校，无疑推动三个好友朝着梦想迈进了一大步。
只是随着成功的降临，他们的友情也开始承受严峻的考验……"
806,绝地重生,,11181000.0,,412.0,21.537777777777784,,,讲述的是1935年红军长征面临生死抉择的关键时刻，行至云南扎西召开了命运转折性的扎西会议，改组了中央领导，重新确定了毛泽东同志军事领导权，在毛主席的正确英明领导下，中国工农红军战士四渡赤水、巧渡金沙江，中国革命走向胜利，从而完成了绝地重生命运改变的故事。
807,我没有失踪,,94000.0,,213.0,15.073333333333332,,,主角罗立松是一名恪守职责的老警察，在一场意外中痛失爱子，但对方下落不明，为证明儿子并未失踪，临近退休的罗立松四处奔走寻找儿子的下落，最终皇天不负有心人，重于找寻到了儿子的下落，不仅还其清白，更证明人民警察“忠诚可靠、服务人民、竭诚奉献、作风优良，不负使命”的精神。
808,根据地,,1987000.0,,73.0,29.65,,,"大型纪录电影《根据地》讲述的是最大的抗日根据地——冀鲁豫根据地的抗战史。
七七事变后，在中国共产党的领导下，冀鲁豫苏皖交界地区的大平原上，人民抗日斗争风起云涌。1938年底开始，八路军东进支队挺进鲁西地区，冀鲁豫支队挺进冀鲁豫地区，苏鲁豫支队挺进湖西地区，建立抗日根据地，1942年形成了“冀鲁豫边区”，到1945年初，发展成为面积达10多万平方公里、人口近两千万的根据地，也是中共领导的19块抗日根据地中最大的一块。
这部时长90分钟的纪录电影，通过普通民众口述的形式，讲述了那段残酷而壮烈的历史，以普通人的视角再现了根据地军民英勇抗争、艰苦奋战、最终取得胜利的故事。"
809,周末狂飙,,335000.0,,26862.0,0.2612903225806451,,4.1,15年前，顶级“车手”乔伊（桂纶镁 饰）与美国缉毒局探员约翰（路克·伊凡斯 饰）坠入爱河，又被迫分开。15年后，乔伊已嫁给大毒枭康俊（姜成镐 饰），本以为从此相忘于江湖，不料约翰突然出现在中国台北街头，势要将康俊捉拿归案……在情感的岔路口，一边是念念不忘的恋人，一边是深情专横的丈夫，乔伊将做出怎样的抉择？惊险刺激的大战，一触即发！
810,灭世魔珠,,5000.0,,4.0,,,,逃离灵界的青女随陈才宁回到故乡，努力融入人族生活。但树欲静而风不止，灵尊末路、捕灵大派坤阳司接踵而至，引起种种风波。面对重重压力与质疑，两人不惜身死救世，以行动向世人证明：人灵可以共存。
811,街一边水一边,,16000.0,,1380.0,0.49999999999999994,,,故事讲述了江南老街一家百年老店的两代女店主，在不同时代背景下命运、生活和情感的遭遇，展现了中国女性的坚忍、善良，对传统的坚守和传承，与现实抗争的勇气和倔强。
812,大内密探灵灵狗,2009-07-30,100220000.0,29.0,,,中国香港/中国,5.3,"庄严的皇宫内，十二位以属相命名的大内密探肩负着贴身保护皇上的重任，其中高天九外号“灵灵狗”（古天乐 饰）是一位满脑子充满奇想秒招的发明家。他靠各种“法宝”在保护皇上的过程中屡建奇功，但对于自己风情万种却功艺高强的未婚妻梅希望（大S 饰）的一片痴心，“灵灵狗”的反应却表现的相当木讷。为了让这“灵灵狗”这个木瓜开窍，梅希望想出了一个试探“灵灵狗”的办法。
深宫之类忠奸难辨，暗藏杀机。围绕公主选附马一事，各方面的力量都暗自勾结，企图谋权篡位并消灭以“灵灵狗”为首的大内密探，皇上安危遭受威胁，十二密探面临前所未有的挑战。"
