movie_id,title,release_date,total_box_office,avg_ticket_price,screening_count,attendance_rate,country,overall_rating,description
386,片警宝音,,250000.0,,3.0,,,6.9,"宝音是一名乌拉特牧民的儿子。作为民警，因为地域广阔，他必须骑着摩托车奔波于1672平方公里的土地上。
宝音的日常工作，除了跑遍各个厂矿企业登记流动人口、为牧民处理各种鸡毛蒜皮的小事外，还义务承担着戈壁邮递员的角色。他的生活看起来孤独、艰辛而又机械，却肩负着维护边疆稳定的重担。
这时候，一些意外事件发生了，尤其是戈壁上来了两个年轻女人。卓拉从锡盟赶来寻亲，生父却一时不愿相认，宝音的母亲希望至今单身的儿子能和卓拉好上……李红是一个汉族姑娘，和男友来到乌拉特草原，却诡异地被杀害了，凶手是谁？迟迟没有线索……此外，宝音因为工作成绩的突出，有望获得一笔特别奖励，他不禁对改善自身贫穷的生活展开了种种憧憬……
总之，平静的工作和生活被打破了，宝音变得有点忙乱不堪。最终，宝音在每件事上都作出了让人感动的选择。"
387,回廊亭,,204999999.99999997,,1.0,,,4.9,"影片根据东野圭吾畅销悬疑小说《长长的回廊》改编。回廊亭大宅中暗藏无数秘密，绝望女人为爱复仇的欲望纷争正在上演！
富商病逝，他的亲属们聚集在回廊亭等待数十亿遗产将会如何分配，众人各怀鬼胎。关键时刻，律师周扬带着遗嘱和一本神秘日记而来，更牵扯出⼀场发生在一年前的火灾凶杀案，死者是富商流落在外的私生子，更是全部遗产的第⼀顺位继承人！凶手，似乎就隐藏在众人之中……"
388,时光记忆,,306000.0,,192.0,2.4583333333333335,,,这是一部让每一个观影者回到青春时光的爱情励志影片。 刚刚大学毕业黄烨霖，宋晓芸这对小情侣，以及他们的好友小憨与王凯瑞四个青年怀揣着梦想，一起走出校门步入社会。面对社会上各色各样的压力和诱惑，他们的不同选择决定了他们不同的人生。各人经历了欺骗，痛苦，失望，悲伤，感动，欢乐，一路坎坷，最终四个小伙伴分别得到了成长，友情和爱情都得到了升华，不仅在职场上取得了不俗的成绩，还在生活中收获了满满的幸福……
389,九层妖塔,2015-09-30,682930000.0,34.0,,,中国,4.4,"1979年，昆仑山发生神秘生物骸骨，由胡八一（赵又廷 饰）率领的探险队深入昆仑山腹地，寻找有关古生物遗迹的更多秘密，却不料在这个过程中遭到不同神秘生物的轮番攻击，并意外坠入九层妖塔，除胡八一外，一行人生死成谜。
胡八一退伍后回到北京，重逢了发小王凯旋（冯粒 饰），并在神秘人（李晨 饰）与科考队（凤小岳、唐嫣、李光洁 饰）两股力量的夹缝中重新踏上了探寻未知文明的征程，途中与Shirley杨（姚晨 饰）邂逅，熟识的面孔唤醒了他身处探险队那段日子的记忆。此行凶险，在还没来得及搞清楚Shirley的真实身份之际，胡八一、Shirley、王胖子率领一行人便在王子墓、石油小镇等地遭到不明生物的轰炸，这里所发生的一切再度指向九层妖塔，而这次等待他们的，将是一个尘封已千年的未解之谜……"
390,出不去的房间,,1000000.0,,23996.0,1.1577777777777778,,,林小楠（姜贞羽 饰）为了帮助挚友陈沫（邹元清 饰）查清埋藏多年的真相，意外通过一个箱子魂穿进入了一座百年老宅。幽暗的房间、神秘的箱子、不完整的全家福、诡异的木雕，每一个房间都暗藏玄机，每一个人都心怀鬼胎。林小楠与陈沫开启极限逃生，这场生死未卜的冒险她们能否活着逃出去……
391,望道,,82036000.0,,114.0,15.23333333333333,,5.8,从日本留学归来的陈望道接下了翻译《共产党宣言》的任务，从此改变了人生轨迹；陈独秀、俞秀松、施存统、经亨颐、戴季陶、蔡慕晖等历史人物一一出场。历经时代动荡变革，友朋或牺牲或离去，陈望道面临生死抉择的考验。
392,脐带,,1701000.0,,239.0,25.175,,7.9,音乐人阿鲁斯（伊德尔 饰）因不满哥哥对患有阿茨海默症的母亲（巴德玛 饰）的照顾方式，决心带她返回草原，去寻找母亲记忆中的家。为了防止母亲走失，阿鲁斯用一根绳子系在两人腰间。似脐带一般的连接，建立起了一种奇妙的“逆位”母子情，牵引着两人向草原深处漫游。当爱由彼此羁绊化为理解和自由， 母亲终于回到心中的故乡，阿鲁斯也得到平静和爱的力量。
393,消失的木偶,,2883000.0,,16.0,2.0,,,"神秘照片女子离奇失踪，诡异木偶循声杀人, 一对年轻男女深陷走不出的阴霾之中, 逃不开死亡诅咒！阴森月夜，幽闭空间，木偶复活……昏暗走廊尽头似有亡魂归来, 究竟是来自木偶的诅咒，还是亡魂的赎罪？当真相浮出的那一刻，所有的爱恨情仇将穿越阴阳两界, 勾勒出重叠交错的鬼魅倩影，恐怖惊悚直击心脏。"
394,时间之子,2025-05-30,187000000.0,35.0,1481534.0,5.318367346938776,中国,6.3,冷面杀手十七与渔村少女千晓因神秘时轮结缘，一个想“离职”找自由，一个想“离岛”寻精彩，他们决定暂时合作成为“一日时轮搭子”，在繁华的大都会开启了一场有惊有喜的浪漫奇遇。在这个过程中，十七和千晓的关系悄悄发生着变化，从最初的冤家对头逐渐变成了默契搭档，两颗心在不经意间靠近的同时，殊不知时轮背后的秘密，也在悄然影响着两人的命运……
395,又见奈良,,5021000.0,,20.0,28.049999999999997,,7.3,电影讲述了一段跨越60年的异国无血缘母女情。年近八十的老奶奶陈慧明（吴彦姝 饰）孤身奔赴奈良，寻找失去联系的养女陈丽华。在遗孤二代小泽（英泽 饰）和退休警察一雄（國村隼 饰）的帮助下，找到了许多接触过、帮助过丽华的人们。在这个过程中，陈慧明如同亲历丽华到达日本之后的人生，她与小泽、一雄之间的关系，也在这段旅程中更加贴近了。
396,风起秋浦河,,131000.0,,3741.0,7.564,,,讲述了一对年轻人从相知到相恋，从分离到重逢的爱情故事；而他们的爷爷，一对兄弟因童年的心灵创伤而离散，又用重逢治愈的亲情故事。
397,我要当老师,,13098000.0,,3705.0,26.70224719101123,,3.6,影片立足当代校园真实生活，讲述了青年教师孙恒，在中学班主任教师高怀德以及冯院长、蒋丽、何睿等老师和同学们帮助下，从懵懂困惑、爆笑闯祸，到融入学生、克服苦难，在欢笑与坚持中，逐步实现“我要当老师”这个理想的心路历程。
398,妈妈和七天的时间,,293000.0,,29.0,5.1571428571428575,,7.1,这是一部纪念妈妈的电影，讲述20世纪90年代在中国农村七天发生的故事。故事里记载了小咸（葛文丹 饰），一个十二岁女孩对家庭和村庄的记忆。在这七天里，发生了三次死亡和两次出生。
399,摇滚诗人:未知的传奇,,1113000.0,,38229.0,3.2718749999999996,,6.5,"影片以1960年代初的纽约音乐界为背景，重现了鲍勃·迪伦插电争议的始末。
19岁的鲍勃·迪伦（提莫西·查拉梅 Timothée Chalamet 饰）背着吉他，从明尼苏达来到纽约西村，他的民谣歌曲得到了偶像的赏识和乐迷的青睐，原本寂寂无名的鲍勃迅速成为纽约民谣界炙手可热的新星。1965年的纽波特民谣音乐节上，鲍勃·迪伦首次在舞台上使用了电吉他，不仅颠覆了民谣音乐的定义，更重新书写了美国音乐的未来。
本片根据以利亚·沃尔德创作的纪实文学《迪伦要插电》改编。"
400,热辣滚烫,2024-02-10,3417000000.0,48.0,34.0,,中国,7.5,"大学毕业后仅仅工作短暂的一段时间，杜乐莹（贾玲 饰）便退回家中，宅家长达十年之久。她无所事事，拒绝和外界做过多接触，甚至和家人的关系也变得紧张起来。在和离婚回到娘家的妹妹乐丹（张小斐 饰）一次激烈的冲突后，乐莹选择离家出走，并且在烧烤店找了服务员的工作勉强维生。爱情、亲情、人生，似乎一时间均跌入了谷底，而阴差阳错间乐莹又结识了落魄的拳击教练昊坤（雷佳音 饰）。她支持着他的梦想，彼此又不得不去面对残酷的现实。人生至暗时刻，随波逐流的女孩是否决心逆流而上？
本片改编自日本电影《百元之恋》。"
401,两情若是久长时,,48000.0,,1065.0,9.743333333333334,,,网络明星丁兰来到边远小镇演出，邂逅同校毕业的方海，地位悬殊的两个人，在严寒的冬天里竟然相互产生了好感，双方历经误会、曲折，一个纯爱版的激情故事在倾情演绎……
402,非诚勿扰2,2010-12-22,328500000.0,39.0,,,中国/中国香港,6.6,"《非诚勿扰2》豆瓣官方小站：http://site.douban.com/108514/
在秦奋（葛优 饰）全然做好与笑笑（舒淇 饰）白头到老的准备之时，笑笑对秦奋的感情却仅仅止步于好感。在秦奋好友李香山（孙红雷 饰）和芒果（姚晨 饰）离婚典礼的启发下，秦奋与笑笑决定试婚。然而，好感毕竟不等同于爱情，共同生活期间，秦奋深沉的爱意 在笑笑那边却变成无形的压力， 两个最后只能分道扬镳。距离远了，感情似乎也就淡了，就在两人似乎已经忘记对方的时候，他们生活的轨迹又一次发生重合。老友李香山罹患重症，在他的人生告别会上，秦奋和笑笑再次相遇，在即将离世的老友点化下，笑笑似乎明白了婚姻的真谛……"
403,太空熊猫英雄归来,,21017000.0,,21.0,,,3.0,"翠绿星是熊猫一族们赖以生存的唯一家园，然而，近日里，这颗本来美丽的星球遭到了大肆破坏，满目疮痍即将走到寿命的尽头。对于糟糕的现状，熊猫国王无计可施只能听天由命，此时，一位名为泰隆（丁研 配音）的王子忽然现身，带来了一张神秘的羊皮卷轴。
在羊皮卷上，记载着一个名为“潘达星”的地方，这里被称为熊猫乐园，是熊猫一族不至于灭亡的唯一希望。就这样，英勇的泰隆和弟弟尚光（王亚林 配音）一同踏上了充满危机的旅途。另一边，邪恶而又贪婪的土狼王对熊猫一族恨之入骨，它派出了潘多拉（叶方 配音）、铁锤（唐泽宗 配音）和红影（王雪沁 配音）三名手下，企图将泰隆一行人彻底消灭。"
404,风味快餐车,,1513000.0,,8183.0,17.083333333333332,,,该片主要内容讲述了年轻人秦韦风为了实现自己的人生理想走上了餐饮创业之路，虽然创业初期经历了许多坎坷。但是秦韦风和他的朋友们依然凭着努力拼搏的精神克服了困难，做出了属于自己特色的美味佳肴，赢得了大家的认可。最终通过努力，创业成功，实现了自己的梦想。
405,越光宝盒,2010-03-18,130590000.0,32.0,,,中国香港/中国,5.4,"个性莽撞的玫瑰仙子（孙俪 饰）渴望能够像紫霞仙子一样找到一世珍爱，于是从日月神灯前盗取那把曾见证旷古爱恋的紫青宝剑来到凡间，希望找到能拔剑出鞘的真命天子。山贼清一色（郑中基 饰）只想本本份份做个山贼，不料却拔出玫瑰仙子的紫青宝剑，之后俩人又意外通过越光宝盒穿越时空，亲历赤壁之战。在穿越的日子里，玫瑰仙子对于拔剑出鞘的清一色百般示爱，而一心想重新踏上穿越时空之路的清一色却对玫瑰仙子只是假意奉承，在利用玫瑰仙子从曹操（郭德纲 饰）手里夺回越光宝盒之后，他毅然弃玫瑰仙子于不顾，独自回到曾经。然而再次偶到玫瑰仙子之时，清一色却发现有一份爱早已在自己的心头生根发芽……
本片借经典影片《月光宝盒》之东风，58位明星倾情加盟，并重新演绎近年来多部影片中的精彩片段，“笑果”非比寻常。"
406,长津湖,2021-09-30,5775000000.0,46.0,5.0,,中国,7.4,电影以抗美援朝战争第二次战役中的长津湖战役为背景，讲述了一段波澜壮阔的历史：71年前，中国人民志愿军赴朝作战，在极寒严酷环境下，东线作战部队凭着钢铁意志和英勇无畏的战斗精神一路追击，奋勇杀敌，扭转了战场态势，打出了军威国威。
407,误判,,270000000.0,,1322441.0,5.15,,6.9,一起贩毒冤案让被告人面临27年牢狱之灾，曾是干探的检控官霍子豪（甄子丹 饰）凭其敏锐触觉和执着，抽丝剥茧展开调查，明面上的口舌之争，暗地里的殊死搏斗一触即发，最终庭审日在即，霍子豪能否击碎不公，极限翻案？
408,雪域少年,,10596000.0,,54.0,,,,那是一个邪恶势力纵横的年代，少年觉如由于部落首领的陷害，被迫和母亲一起离开家乡漂泊至黄河下游，在新部落里觉如和大家一起抵抗魔族入侵，并认识了莲师习得了降妖伏魔之术。觉如慢慢长大，母亲却日益衰老，为救母亲觉如决定出门找寻求神药，在寻药途中遇到了自己的青梅竹马珠牧，在觉如的帮助下，珠牧死里逃生，而觉如也得知了家乡正在遭遇灭顶之灾。寻药之路困难重重，觉如和珠牧是否能寻得神药？回家乡的觉如又会遭遇怎样的危险？少年觉如的英雄之路正式开启……
409,小时代3：刺金时代,2014-07-17,521560000.0,32.0,,,中国,4.8,"林萧（杨幂 饰）、顾里（郭采洁 饰）、南湘（郭碧婷 饰）、唐宛如（谢依霖 饰）四个从小一起长大的好姐妹大学毕业进入职场，开始了新的旅程。
原本离开了姐妹们，准备和堕落的男友席城（姜潮 饰）离开上海的南湘重新回归到姐妹们身边。顾里率领众人搬进了新的别墅，大家继续着同一屋檐下的乌托邦生活。林萧、顾里陪同宫洺（锦荣 饰）参加罗马的时尚活动，还叫上了南湘和唐宛如，又在罗马遇上了顾里的混血表弟Neil（李贤宰 饰）。然而当林萧回到上海，却接到了男友崇光（陈学冬 饰）癌症复发不幸去世的噩耗。
几个月后，终于振作起来重新开始新生活的林萧却遇到了一个总是让她莫名想起崇光的外国模特陆烧（陈学冬 饰）。与此同时，顾里从未见过面的亲生弟弟顾准（任佑明 饰）突然出现，手握顾家20%的隐藏股份，他告诉顾里M.E有一个巨大的财务漏洞，姐弟两人联手想要夺回被M.E收购的盛古公司。..."
410,你是我的冠军,,11000.0,,331.0,13.542857142857141,,,少年杨一辰为了逃避母亲管教，跟随教练沈冬学习花样滑冰。当他真正爱上花滑后，妈妈的一场重病，成为他心中挥之不去的痛。为了给妈妈治病，他放弃了挚爱的花滑。最终，在众人的鼓励下，他重整旗鼓，向梦想进发。
411,窗前明月，咣！,,39845000.0,,279751.0,11.943333333333328,,4.7,金牌律师胡恭平（费翔 饰）与情人佘小漫（傅菁 饰）幽会时，房间突然天降尸体（宋小宝 饰），胡恭平喊来冤种助理朱士奇（左凌峰 饰）帮忙，却不想惊慌中脱口而出的数个谎言引发了一连串乱子！随着熊大力（马东锡 饰）、林銮凤（黄小蕾 饰）、施诗（史策 饰）等各路“家属”轮番出现，状况不断升级，眼看事情就要败露，这场充满笑料的“事故”将如何收场？
412,海王,2018-12-07,1852180000.0,36.0,,,美国,7.6,"许多年前，亚特兰蒂斯女王（妮可·基德曼 Nicole Kidman 饰）和人类相知相恋，共同孕育了爱情的结晶——后来被陆地人称为海王的亚瑟·库瑞（杰森·莫玛 Jason Momoa 饰）。在成长的过程中，亚瑟接受海底导师维科（威廉·达福 Willem Dafoe 饰）的严苛训练，时刻渴望去看望母亲，然而作为混血的私生子这却是奢望。与此同时，亚瑟的同母异父兄弟奥姆（帕特里克·威尔森 Patrick Wilson 饰）成为亚特兰蒂斯的国王，他不满陆地人类对大海的荼毒与污染，遂谋划联合其他海底王国发动对陆地的全面战争。为了阻止他的野心，维科和奥姆的未婚妻湄拉（艾梅柏·希尔德 Amber Heard 饰）将亚瑟带到海底世界。
宿命推动着亚瑟，去寻找失落已久的三叉戟，建立一个更加开明的海底王国……"
413,西游记之大闹天宫,2014-01-31,1045490000.0,42.0,,,中国/中国香港,4.4,魔界之王牛魔王（郭富城 饰）与玉帝（周润发 饰）为首的神界展开战斗，神界被毁，女娲（张梓琳 饰）化身晶石修补天庭，遗落下的一小颗晶石落到人间成了一只石猴，而牛魔王则战败被迫带着妻子铁扇公主（陈乔恩 饰）躲到了火焰山。若干年后石猴得到了菩提老祖（海一天 饰）的教导被赐名孙悟空（甄子丹 饰），孙悟空来到花果山自立为王，还抢走了东海龙王（刘桦 饰）的定海神针当武器。同时牛魔王立志东山再起，利用了孙悟空与青梅竹马的小狐狸精（夏梓桐 饰）的感情煽动孙悟空大闹天宫，又串通了二郎神（何润东 饰）一起破坏了南天门，孙悟空势在必得，天庭危在旦夕。
414,初恋这首情歌,,748000.0,,1.0,80.3,,8.2,"故事发生在1980年代的都柏林，因为家境窘迫，十四岁的少年康纳（福迪亚·瓦尔什-匹罗 Ferdia Walsh-Peelo 饰）不得不转学来到了一所校规极为严苛死板的教会学校中就读。在那里，他惹上了横行霸道脾气古怪的巴里（伊安·肯尼 Ian Kenny 饰），可见未来的日子不会好过。
某日，康纳邂逅了名叫蕾菲娜（露西·宝通 Lucy Boynton 饰）的美丽女孩，为了吸引蕾菲娜的注意，康纳邀请她来主演自己乐队拍摄的MV，哪知道蕾菲娜欣然应允，那么问题来了，对演奏音乐几乎一窍不通的康纳，该如何在短时间内组建一支乐队呢？好在康纳拥有一群热爱音乐的朋友们，很快，一支名为“唱街”的乐队成立了。"
415,曾经的我们致70·80·90,,4945.0,,533.0,4.245454545454545,,,钟表修理师张德行(金良饰)、模特雅楠(周娇饰)、富二代宫德帅(冶彦饰)被传销组织人员以拉人头，卖产品，炫富等不同方式骗到传销窝点。为了逃出传销窝点，他们和传销头目斗智斗勇，经历各种挫折后被警察成功解救，逃脱后的他们又会何去何从。
416,抗战中的文艺（舞台纪录电影·话剧）,,158000.0,,26.0,1.6333333333333335,,,影片以文献话剧的形式，再现1931年至1945年，胸怀爱国之志的文艺家们在党的文艺方针正确指引下，确立以人民为中心的创作方向，寻找中国文艺出路的故事。饱含民族情感，致敬抗战中的文艺经典。
417,检察风云,,61830000.0,,2.0,,,4.4,大学教授夏薇（王丽坤 饰）涉嫌故意杀人，舆论发酵失控，多方压力涌来。随着检察官李睿（黄景瑜 饰）和同事张有成（王千源 饰）对该案进行审查，发现作恶多端的富商陈鑫（包贝尔 饰）与此案密切相关，一桩深埋多年的旧案被牵出…故意杀人案、强奸案、官商勾结环环相扣，所有人都被迫卷进这场命运的漩涡。李睿与夏薇辩护律师童雨辰（白百何 饰）在法庭上激烈交锋，夏薇究竟为何沉默不语？她的丈夫洪俊山（冯绍峰 饰）又隐藏了什么秘密？正邪敌我难辨，无法预料的危机等待着众人…
418,花儿为什么这样红,,6911000.0,,41.0,,,,影片由新疆维吾尔自治区党委宣传部组织策划、天山电影制片厂创作拍摄。根据“时代楷模”拉齐尼·巴依卡一家三代在帕米尔高原戍边的故事和英雄事迹改编。生动还原了拉齐尼·巴依卡一家三代为国守边护边70余年的传奇故事，颂扬了拉齐尼·巴依卡一家对伟大祖国的赤胆忠心和深厚的家国情怀，对于彰显和诠释共产党员的初心和使命，弘扬爱国主义和英雄主义精神。
419,她的小梨涡,,357000.0,,4748.0,1.3705882352941177,,,"你还记得自己17岁时喜欢的人吗？成绩优异的南方女孩许呦（漆昱辰 饰）转学来到临市，意外和“校霸”谢辞（张哲华 饰）成了同桌，两人在嬉笑吵闹中逐渐走进了对方的内心，却面临命运的捉弄。多年以后，两人再次回到故事开始的地方，才发现年少的欢喜就像苹果味的棒棒糖，兜兜转转还是第一颗最甜……
影片改编自唧唧的猫的同名小说。"
420,单声,,2701000.0,,1324.0,47.60291262135925,,,该片是首部真实记录侨领单声传奇一生与家国情怀的电影纪录片。
421,熊出没之熊心归来,,287000000.0,,13.0,,,7.8,"雨季降至，为了避免塌方，熊大（张伟 配音）带领着动物们开始加固堤坝，然而，动物们对此很不上心，偷懒的偷懒，逃避的逃避，令熊大很是生气。一场意外中，泥石流袭来，熊大被冲走了，当它醒来之时，发现自己竟然身处一间马戏团之中。熊大利用自己的实力获得了留在马戏团里表演的资格，并且很快就成为了当红的动物明星。
随着时间的推移，被名声和荣誉冲昏了头脑的熊大渐渐忘记了想要回到森林之中的念头，他和马戏团团长黑猩猩亦产生了心心相惜的友谊。熊二（张秉君 配音）找到了熊大，希望熊大能够跟它回家，因为森林里的动物们一个接着一个神秘失踪了，然而熊大却拒绝了熊二的请求，继续做着它的明星梦。"
422,家在澳门,,21000.0,,33.0,44.042857142857144,,,"《家在澳门》片长97分钟，由《老巷新韵》《回家的人》《武林凡人》《粤曲童声》《筑梦大湾》5个篇章构成，前后历时7年拍摄完成。
电影中，有被称为“澳门设计第一人”的设计师，有在内地、澳门求学全心研究中西文化融合的大学教师，有坚守在青少年粤剧培养第一线的艺术家，有获得“专业功绩勋章”的会展人才，有被业界誉为“CEPA第一人”的“律界巾帼”，还有澳门国际武术节创始人、太极拳非遗传承人、澳门旅游形象大使……影片通过故事化表达、纪实跟拍等表现手法，讲述了11位澳门人学习、生活、工作的真实故事。"
423,无毒岛I,,1905.0,,36.0,,,,"本片根据海南省海口市6.22真实事件改编。
美丽的海岛城市滨海看似平静的表面下毒潮汹涌，缉毒警徐飞根据线人许三筒的线报获知滨海市近期冰毒价钱有幅下降，徐飞推断近期可能会有大批冰毒流入本市。同时徒弟陈晓丹在桥头镇居委会发现复吸人员数量有增无减。警方经过多方排查和技术侦测，发现桥头村的确隐藏着一个巨大的制毒工厂，市局当即决定成立禁毒专案组，此次行动代号定为“狩猎”，打响了滨海市禁毒三年大会战的第一炮！一场正义与邪恶沉沦与救赎之战正在上演……"
424,机动战士高达NT,,8707000.0,,8.0,0.8,,5.8,U. C.0097时期，“拉普拉斯事变”的纷争终结后，2架独角兽高达被秘密封印，新吉翁残党“袖章”也随之瓦解。就在人类逐渐走出战争带来的阴影之时，失踪两年的独角兽三号机“凤凰”突然现身，拥有颠覆世界秩序力量的它即刻引发了地球联邦军、吉翁袖章残党以及路欧商会三方势力的争夺狩猎，一场宇宙对决也即将拉开帷幕......
425,妈妈，我想你,,1931000.0,,4013.0,7.723529411764707,,,家是永远的归宿，母爱是永恒的港湾！突发而至的横祸，将一个幸福的家庭拆得支离破碎，母子四人不得已亡命天涯，陷入重重危机……本片为您讲述一个感人至深的人间真情故事～
426,木乃伊3,2008-09-02,110000000.0,31.0,,,德国/加拿大/美国/中国,5.7,"1947年，中国宁夏。中国两千年前的始皇帝：龙帝之墓在此挖掘出土。同时在美国，大探险家欧康诺（Brendan Fraser饰）与夫人伊芙琳（Maria Bello饰）应邀，将传说中能带来永生的宝石“香格里拉之眼”送往中国，以示中美两国人民友谊长存。
不料，国民党军官（黄秋生饰）却和博物馆馆长勾结，当场抢走香格里拉之眼，继而唤醒了两千年前的邪恶力量——龙帝（李连杰饰），此时的龙帝不仅可以借助五行之力施暴，还可以变身为各种怪物涂炭天下生灵。
欧康诺一家奋力与龙帝和他身后庞大的兵马俑队伍展开战斗，千年圣女紫媛（杨紫琼饰）与其女林娜（梁洛施饰）也入盟此支神圣的队伍，以期消灭龙帝，还世界以和平。"
427,乡见未晚,,308000.0,,2155.0,4.141463414634146,,,"大龄未婚的马丽在大城市打拼多年一直不愿回乡，为了安置失联男友的儿子，被迫回到多年不愿回的家乡。一个人生低谷的女人，一个无处安置的小孩，一个难以相处的父亲，还有一段难以释怀的往事......
回乡之旅注定冲突不断，隔阂已久的父女二人如何“乡见”？"
